{"schema":"akashic.knowledge-packet-registry/v1","generated_at":"2026-08-16T08:20:00Z","source":{"library_file_id":"file_0000000062088209914abe678232d2da","name":"akashic_external_knowledge_packets_2026-08-16.json","sha256":"80d20a23c8015da37f52999178f1da1140ab21f03a7888d743959d439e409db3","packet_count":30},"base":{"repository":"tanakaryotadayo-wq/whatever","branch":"akashic/v0.7-canonical-final","commit":"134fb210e0e0f91d95e7b954f64088f223081b06"},"target_branch":"akashic/v0.8-knowledge-packet-import","packets":[{"packet_id":"KPK-001","adoption_status":"IMPORT_THIS_BRANCH","target_paths":[".agents/skills/","plugins/akashic/README.md"]},{"packet_id":"KPK-002","adoption_status":"IMPORT_THIS_BRANCH","target_paths":["packages/contracts/src/mcp-tasks.js"]},{"packet_id":"KPK-003","adoption_status":"ALREADY_IMPLEMENTED","target_paths":["workflows/temporal/src/workflows.js"]},{"packet_id":"KPK-004","adoption_status":"ALREADY_IMPLEMENTED","target_paths":["apps/temporal-runner/src/rpc.js"]},{"packet_id":"KPK-005","adoption_status":"PARTIAL_PROVIDER_GATE","target_paths":["workflows/temporal/src/workflows.js","scripts/codex-live-acceptance.sh"]},{"packet_id":"KPK-006","adoption_status":"HARDEN_THIS_BRANCH","target_paths":["packages/contracts/src/effects.js","workflows/temporal/src/activities.js"]},{"packet_id":"KPK-007","adoption_status":"ALREADY_IMPLEMENTED","target_paths":["packages/contracts/src/index.js"]},{"packet_id":"KPK-008","adoption_status":"IMPORT_THIS_BRANCH","target_paths":["packages/contracts/src/provenance.js"]},{"packet_id":"KPK-009","adoption_status":"IMPORT_THIS_BRANCH","target_paths":["workflows/temporal/src/worker-deployment.js","workflows/temporal/src/task-queues.js","workflows/temporal/src/worker-topology.js","docs/ADR-0005-TEMPORAL-WORKER-DEPLOYMENTS.md"]},{"packet_id":"KPK-010","adoption_status":"IMPORT_THIS_BRANCH","target_paths":["packages/drive-adapter/","schemas/v1/drive-mailbox-envelope.schema.json","docs/ADR-0006-DRIVE-IMMUTABLE-ADAPTER.md"]},{"packet_id":"KPK-011","adoption_status":"IMPORT_THIS_BRANCH","target_paths":["packages/contracts/src/context-memory.js"]},{"packet_id":"KPK-012","adoption_status":"IMPORT_THIS_BRANCH","target_paths":["packages/contracts/src/context-memory.js"]},{"packet_id":"KPK-013","adoption_status":"IMPORT_THIS_BRANCH","target_paths":["packages/contracts/src/policy.js"]},{"packet_id":"KPK-014","adoption_status":"IMPORT_THIS_BRANCH","target_paths":["packages/contracts/src/events.js"]},{"packet_id":"KPK-015","adoption_status":"PARTIAL_VIA_MCP_TASKS","target_paths":["packages/contracts/src/mcp-tasks.js"]},{"packet_id":"KPK-016","adoption_status":"IMPORT_THIS_BRANCH","target_paths":["packages/contracts/src/provenance.js"]},{"packet_id":"KPK-017","adoption_status":"DEFER_PROVIDER_GATE","target_paths":["knowledge/PACKET_ADOPTION_MATRIX.md"]},{"packet_id":"KPK-018","adoption_status":"NEXT_IMPLEMENTATION","target_paths":["knowledge/PACKET_ADOPTION_MATRIX.md"]},{"packet_id":"KPK-019","adoption_status":"IMPORT_THIS_BRANCH","target_paths":["packages/contracts/src/routing.js"]},{"packet_id":"KPK-020","adoption_status":"DEFER_CLIENT_SUPPORT","target_paths":["knowledge/PACKET_ADOPTION_MATRIX.md"]},{"packet_id":"KPK-021","adoption_status":"DEFER_AFTER_SINGLE_AGENT","target_paths":["knowledge/PACKET_ADOPTION_MATRIX.md"]},{"packet_id":"KPK-022","adoption_status":"NEXT_IMPLEMENTATION","target_paths":["knowledge/PACKET_ADOPTION_MATRIX.md"]},{"packet_id":"KPK-023","adoption_status":"IMPORT_THIS_BRANCH","target_paths":["packages/contracts/src/sessions.js"]},{"packet_id":"KPK-024","adoption_status":"DEFER_UNTIL_HISTORY_PRESSURE","target_paths":["knowledge/PACKET_ADOPTION_MATRIX.md"]},{"packet_id":"KPK-025","adoption_status":"DEFER_UNTIL_DUAL_WRITE","target_paths":["knowledge/PACKET_ADOPTION_MATRIX.md"]},{"packet_id":"KPK-026","adoption_status":"IMPORT_EXPERIMENT_HARNESS","target_paths":["experiments/orchestrator-bakeoff/"]},{"packet_id":"KPK-027","adoption_status":"REJECT_DUPLICATE_REFS_FIRST","target_paths":["knowledge/PACKET_ADOPTION_MATRIX.md"]},{"packet_id":"KPK-028","adoption_status":"DEFER","target_paths":["knowledge/PACKET_ADOPTION_MATRIX.md"]},{"packet_id":"KPK-029","adoption_status":"DEFER","target_paths":["knowledge/PACKET_ADOPTION_MATRIX.md"]},{"packet_id":"KPK-030","adoption_status":"DEFER","target_paths":["knowledge/PACKET_ADOPTION_MATRIX.md"]}]}